{
  "$schema": "https://json-schema.org/draft/2020-12/schema",
  "$id": "https://agentlens.dev/schemas/agentlens.waygent_projection.v1.json",
  "$comment": "Derived Waygent projection artifact.",
  "title": "agentlens.waygent_projection.v1",
  "type": "object",
  "additionalProperties": false,
  "required": ["schema", "run_id", "waygent_run_id", "producer", "status", "event_count", "timeline", "tasks"],
  "properties": {
    "schema": {"type": "string", "const": "agentlens.waygent_projection.v1"},
    "run_id": {"type": ["string", "null"]},
    "waygent_run_id": {"type": ["string", "null"]},
    "producer": {"type": "string", "const": "waygent"},
    "status": {"type": "string"},
    "event_count": {"type": "integer", "minimum": 0},
    "timeline": {"type": "array", "items": {"type": "object"}},
    "tasks": {"type": "array", "items": {"type": "object"}},
    "artifacts": {"type": "object"},
    "coverage": {"type": "object"},
    "projection_issues": {"type": "array", "items": {"type": "object"}},
    "agentlens_emit_health": {"type": "object"},
    "payload_safety": {"type": "string"}
  }
}
